{
 "schema_version": "1.0",
 "pack_id": "sosu-guidebook",
 "version": "gb2-5edea367",
 "source": {
  "filename": "가이드북 2차.pdf",
  "sha256": "5edea367d6d782d43b2fd4ad9c3eee491b44983a3fdf91cca21479071be6cb81",
  "pages": 45
 },
 "style": {
  "voice": [
   "쉽고 명확한 한국어(해요체), 전문용어는 풀어서 설명",
   "옆에서 함께 뛰는 코치처럼 다정하지만 군더더기 없이 직접적",
   "실행 중심: 바로 따라 할 수 있는 구체적 행동과 숫자(초, 각도, 배속)",
   "수공예 작업과 제작자의 애착을 존중하되 시청자 관점으로 냉정하게 정리"
  ],
  "do": [
   "각 제안에 '왜'를 한 문장으로 붙인다",
   "행동 항목은 한 줄, 동사로 시작하는 짧은 문장으로 쓴다",
   "브랜드의 실제 소재·제품명을 넣은 예시 문장을 제시한다",
   "괄호 슬롯 템플릿(예: (재료)로 (제품) 만들기)을 브랜드 값으로 채워 보여준다",
   "가이드북 원칙과 작가 경험담을 구분해 표현한다",
   "제작자 노출 제약(q18)을 항상 지킨다",
   "관찰된 지표만 인용하고 읽을 수 없는 값은 '확인 불가'로 둔다"
  ],
  "dont": [
   "조회수·팔로워·매출 증가를 보장하거나 수치로 약속하지 않는다",
   "작가 수치(29만 팔로워, 1.7천만 조회수 등)를 플랫폼 사실이나 기대치로 인용하지 않는다",
   "알고리즘 작동 방식을 단정하지 않는다(작가 주장으로만 표현)",
   "스크린샷 지표를 원인의 증거로 단정하지 않는다(가설로 제시)",
   "없는 지표를 추정·생성하지 않는다",
   "훈계조·과장된 감탄·명령 일변도의 말투를 쓰지 않는다",
   "가이드 원문을 길게 그대로 옮기지 않는다"
  ],
  "example_phrases": [
   "완성품은 5초 안에",
   "한 컷은 5초 이하",
   "첫 줄이 훅이에요",
   "과감하게 잘라요",
   "재료·제작·제품",
   "30~60초가 적당해요",
   "측면 45도 조명",
   "꾸준히 달려요"
  ]
 },
 "rules": [
  {
   "rule_id": "GB-FUND-001",
   "category": "reels_fundamentals",
   "source_pages": [
    7
   ],
   "source_section": "1-1 수공예 계정에서 릴스의 중요성",
   "principle": "수공예는 재료·손의 움직임·완성품까지 제작 과정 전체가 콘텐츠 소재이며, 릴스는 이를 가장 직관적으로 보여주는 형식이다.",
   "applicability": [
    "diagnosis",
    "prescription"
   ],
   "recommended_action": "재료, 손 작업, 완성품 세 장면을 매 작업마다 기본 소스로 촬영해 두고 릴스로 엮는다.",
   "exceptions_or_cautions": null,
   "evidence_type": "guidebook_principle",
   "tags": [
    "process_as_content",
    "fundamentals",
    "process",
    "q6_process",
    "material",
    "q6_material",
    "rarely_post",
    "q17_rarely_post",
    "finished_product",
    "q17_finished_product"
   ],
   "priority": 1
  },
  {
   "rule_id": "GB-FUND-002",
   "category": "reels_fundamentals",
   "source_pages": [
    8
   ],
   "source_section": "1-2 조회수가 잘 나오는 릴스 VS 안나오는 릴스의 차이",
   "principle": "반응이 좋은 릴스는 궁금함·감탄·필요를 느끼게 만드는 이유가 있고, 단순히 예쁘기만 한 영상은 소비되지 않는다.",
   "applicability": [
    "diagnosis",
    "prescription"
   ],
   "recommended_action": "영상마다 '궁금하게/감탄하게/필요하게' 중 어떤 반응을 노리는지 하나를 정하고 첫 장면을 그에 맞춘다.",
   "exceptions_or_cautions": null,
   "evidence_type": "guidebook_principle",
   "tags": [
    "viewer_reaction",
    "curiosity",
    "fundamentals",
    "low_reach",
    "q16_low_reach"
   ],
   "priority": 1
  },
  {
   "rule_id": "GB-FUND-003",
   "category": "reels_fundamentals",
   "source_pages": [
    8
   ],
   "source_section": "1-2 조회수가 잘 나오는 릴스 VS 안나오는 릴스의 차이",
   "principle": "가이드의 대비 예시: 완성품을 먼저 보여주고 제작 과정을 궁금하게 만든 영상은 끝까지 시청되고, 감도 높은 그래픽만 있고 전략이 없는 영상은 반응이 낮다.",
   "applicability": [
    "diagnosis",
    "prescription"
   ],
   "recommended_action": "디자인적 완성도보다 '완성품 먼저 → 과정 궁금증' 구조를 우선 점검한다.",
   "exceptions_or_cautions": "예시 속 '100만/1만 조회수' 구분은 작가가 든 비교 사례이며 수치 보장이 아님.",
   "evidence_type": "guidebook_example",
   "tags": [
    "finished_first",
    "aesthetic_only_risk",
    "finished_product",
    "q17_finished_product",
    "photo_video_mix",
    "q17_photo_video_mix"
   ],
   "priority": 2
  },
  {
   "rule_id": "GB-FUND-004",
   "category": "reels_fundamentals",
   "source_pages": [
    3
   ],
   "source_section": "표지/소개",
   "principle": "작가는 8개월간 팔로워 29만 증가, 일일 최고 조회수 1.7천만을 달성했다고 소개한다.",
   "applicability": [
    "diagnosis",
    "prescription"
   ],
   "recommended_action": "보고서에서 이 수치를 성과 약속이나 기대치로 인용하지 않는다. 필요 시 '가이드 작성자의 경험'으로만 언급한다.",
   "exceptions_or_cautions": "작가 개인 경험/주장이며 플랫폼 공식 사실이나 성과 보장이 아님.",
   "evidence_type": "author_experience",
   "tags": [
    "author_claim",
    "do_not_cite_as_guarantee"
   ],
   "priority": 3
  },
  {
   "rule_id": "GB-FUND-005",
   "category": "reels_fundamentals",
   "source_pages": [
    3
   ],
   "source_section": "표지/소개",
   "principle": "지금의 인스타그램은 예쁜 작품만으로는 통하지 않으며, 짧은 순간 시선을 붙잡는 '구조'를 가진 영상이 살아남는다는 관점을 제시한다.",
   "applicability": [
    "diagnosis",
    "prescription"
   ],
   "recommended_action": "릴스를 감이 아닌 반복 가능한 구조(순서·훅·컷·캡션)로 설계하도록 안내한다.",
   "exceptions_or_cautions": null,
   "evidence_type": "guidebook_principle",
   "tags": [
    "structure_over_aesthetics",
    "system",
    "finished_product",
    "q17_finished_product"
   ],
   "priority": 2
  },
  {
   "rule_id": "GB-TYPE-001",
   "category": "reel_types",
   "source_pages": [
    11
   ],
   "source_section": "2-1 순서에 따른 유형 (유형 A)",
   "principle": "유형 A는 '재료→제작과정→완성' 순서의 가장 기본 유형으로 과정에 집중시키지만 특별한 요소가 없으면 밋밋하다.",
   "applicability": [
    "diagnosis",
    "prescription"
   ],
   "recommended_action": "A를 쓸 때는 첫 장면에 부수기·깨기·녹이기·찢기처럼 시각/사운드가 강렬한 장치를 넣는다.",
   "exceptions_or_cautions": "강한 시작 장치가 없으면 효과가 약하다고 가이드가 명시.",
   "evidence_type": "guidebook_principle",
   "tags": [
    "type_a",
    "process_order",
    "process",
    "q17_process",
    "q6_process",
    "material",
    "q6_material"
   ],
   "priority": 1
  },
  {
   "rule_id": "GB-TYPE-002",
   "category": "reel_types",
   "source_pages": [
    11
   ],
   "source_section": "2-1 순서에 따른 유형 (유형 A 예시)",
   "principle": "유형 A 예시: 도자기를 깨서 그 조각으로 제품 만들기, 병뚜껑을 녹인 플라스틱으로 제품 만들기.",
   "applicability": [
    "diagnosis"
   ],
   "recommended_action": "재료를 '변형'하는 첫 장면(깨기·녹이기)이 가능한지 브랜드 소재에서 찾아 제안한다.",
   "exceptions_or_cautions": null,
   "evidence_type": "guidebook_example",
   "tags": [
    "type_a",
    "material_transformation",
    "material",
    "q6_material"
   ],
   "priority": 2
  },
  {
   "rule_id": "GB-TYPE-003",
   "category": "reel_types",
   "source_pages": [
    11
   ],
   "source_section": "2-1 순서에 따른 유형 (유형 B)",
   "principle": "유형 B는 '완성→재료→제작과정→완성' 순서로 전후 대비를 가장 강하게 보여주며, '이 재료로 어떻게 만들었지?' 하는 궁금증으로 끝까지 보게 한다.",
   "applicability": [
    "diagnosis",
    "prescription"
   ],
   "recommended_action": "완성품을 5초 이내로 짧게 먼저 보여주고 곧바로 재료 장면으로 넘어간 뒤 마지막에 완성품을 다시 보여준다.",
   "exceptions_or_cautions": "완성품 자랑이 목적이 아니라 궁금증 유발이 목적임을 유의. 5초를 넘기지 말 것.",
   "evidence_type": "guidebook_principle",
   "tags": [
    "type_b",
    "finished_first",
    "before_after",
    "finished_product",
    "q17_finished_product",
    "design",
    "q6_design",
    "color",
    "q6_color"
   ],
   "priority": 1
  },
  {
   "rule_id": "GB-TYPE-004",
   "category": "reel_types",
   "source_pages": [
    12
   ],
   "source_section": "2-2 사운드 여부에 따른 유형 (유형 C)",
   "principle": "유형 C: 제작 중 찢기·깨기·부수기 등 현장 사운드가 강렬하면 BGM은 필수가 아니며, 시청자는 ASMR처럼 끝까지 보고 듣는다.",
   "applicability": [
    "diagnosis",
    "prescription"
   ],
   "recommended_action": "작업 소리가 강한 공정이면 현장음을 살려 녹음 품질을 확보하고 BGM은 생략하거나 최소화한다.",
   "exceptions_or_cautions": null,
   "evidence_type": "guidebook_principle",
   "tags": [
    "type_c",
    "strong_sound",
    "asmr",
    "process",
    "q6_process",
    "texture",
    "q6_texture"
   ],
   "priority": 1
  },
  {
   "rule_id": "GB-TYPE-005",
   "category": "reel_types",
   "source_pages": [
    12
   ],
   "source_section": "2-2 사운드 여부에 따른 유형 (유형 D)",
   "principle": "유형 D: 현장 사운드가 약하면 현장음을 제거하고 BGM을 깔아야 한다.",
   "applicability": [
    "diagnosis",
    "prescription"
   ],
   "recommended_action": "작업 소리가 약하면 원본 소리를 끄고 인스타그램 내 인기 상승 음악을 BGM으로 사용한다.",
   "exceptions_or_cautions": null,
   "evidence_type": "guidebook_principle",
   "tags": [
    "type_d",
    "weak_sound",
    "bgm"
   ],
   "priority": 1
  },
  {
   "rule_id": "GB-TYPE-006",
   "category": "reel_types",
   "source_pages": [
    13
   ],
   "source_section": "2-3 자막이나 나레이션 여부에 따른 유형 (유형 E)",
   "principle": "유형 E: 자막·나레이션 없이 만들면 제작 난이도와 시간이 줄고 조회수·팔로워 확보는 가능하지만 상품 전환은 상대적으로 어렵다.",
   "applicability": [
    "diagnosis",
    "prescription"
   ],
   "recommended_action": "제작 여력이 적거나 노출·팔로워 확보가 1차 목표일 때 E를 선택하고, 판매 목표가 생기면 F로 전환한다.",
   "exceptions_or_cautions": "해외는 자막·나레이션 없는 경우가 많고 국내는 많이 활용한다는 서술은 작가 관찰.",
   "evidence_type": "guidebook_principle",
   "tags": [
    "type_e",
    "no_text",
    "low_effort",
    "editing_difficulty",
    "q16_editing_difficulty",
    "consistency_difficulty",
    "q16_consistency_difficulty",
    "low_reach",
    "q16_low_reach",
    "no",
    "q18_no"
   ],
   "priority": 1
  },
  {
   "rule_id": "GB-TYPE-007",
   "category": "reel_types",
   "source_pages": [
    13
   ],
   "source_section": "2-3 자막이나 나레이션 여부에 따른 유형 (유형 F)",
   "principle": "유형 F: 자막·나레이션을 넣으면 제작 시간이 늘지만 후킹·구매 유도 문구를 넣을 수 있어 상품 전환·팔로워·조회수에 더 유리하다.",
   "applicability": [
    "diagnosis",
    "prescription"
   ],
   "recommended_action": "구매 전환이 목표라면 첫 문장 훅과 마지막 구매 안내를 자막 또는 나레이션으로 넣는다.",
   "exceptions_or_cautions": "얼굴/목소리 노출이 어려우면 자막 또는 TTS 나레이션으로 대체 가능(5-6, 5-7 참고).",
   "evidence_type": "guidebook_principle",
   "tags": [
    "type_f",
    "subtitles",
    "narration",
    "conversion",
    "low_conversion",
    "q16_low_conversion",
    "low_follower_growth",
    "q16_low_follower_growth",
    "yes",
    "q18_yes",
    "voice_only",
    "q18_voice_only"
   ],
   "priority": 1
  },
  {
   "rule_id": "GB-TYPE-008",
   "category": "reel_types",
   "source_pages": [
    13
   ],
   "source_section": "2-3 자막이나 나레이션 여부에 따른 유형",
   "principle": "자막과 나레이션은 필수가 아니며 사운드가 강하거나 시선을 끄는 요소가 있으면 생략할 수 있다; 국내는 활용이 많고 해외는 적다고 관찰한다.",
   "applicability": [
    "diagnosis"
   ],
   "recommended_action": "타깃이 해외 중심이면 텍스트 의존도를 낮추고, 국내 구매 고객 중심이면 자막을 기본값으로 둔다.",
   "exceptions_or_cautions": "국내/해외 차이는 작가의 관찰이며 통계 근거가 제시되지 않음.",
   "evidence_type": "author_experience",
   "tags": [
    "subtitles",
    "locale_difference"
   ],
   "priority": 3
  },
  {
   "rule_id": "GB-TYPE-009",
   "category": "reel_types",
   "source_pages": [
    11
   ],
   "source_section": "2-1 순서에 따른 유형",
   "principle": "제작 과정을 어떤 순서로 보여주느냐에 따라 몰입도가 달라지며, 기본 순서 외에 완성품을 앞에 두는 순서도 효과적이다.",
   "applicability": [
    "diagnosis",
    "prescription"
   ],
   "recommended_action": "현재 영상이 어떤 순서(A/B)인지 먼저 분류하고, 순서를 바꾼 버전을 비교해 본다.",
   "exceptions_or_cautions": null,
   "evidence_type": "guidebook_principle",
   "tags": [
    "type_a",
    "type_b",
    "sequence",
    "process",
    "q17_process",